training/scripts/dated/20241109-200946/katago/KataGoData/opencltuning/tune11_gpuNVIDIAGeForceRTX4060LaptopGPU_x19_y19_c384_mv14.txt
VERSION=11
#canUseFP16Storage
1
#canUseFP16Compute
0
#canUseFP16TensorCores
1
#canUseFP16TensorCoresFor1x1
0
#shouldUseFP16Storage
1
#shouldUseFP16Compute
0
#shouldUseFP16TensorCores
1
#shouldUseFP16TensorCoresFor1x1
0
#xGemmDirect
WGD=32 MDIMCD=8 NDIMCD=8 MDIMAD=8 NDIMBD=8 KWID=8 VWMD=2 VWND=4 PADA=1 PADB=1
#xGemm
MWG=64 NWG=64 KWG=16 MDIMC=16 NDIMC=16 MDIMA=16 NDIMB=16 KWI=2 VWM=4 VWN=4 STRM=0 STRN=0 SA=1 SB=1
#xGemm16
MWG=64 NWG=64 KWG=16 MDIMC=16 NDIMC=16 MDIMA=16 NDIMB=16 KWI=2 VWM=4 VWN=4 STRM=0 STRN=0 SA=1 SB=1
#hGemmWmma
MWG=64 NWG=64 KWG=64 MWAVE=16 NWAVE=16 MWARP=16 NWARP=16 VWM=2 VWN=2 SA=0 SB=0
#hGemmWmmaNCHW
MWG=16 NWG=16 KWG=16 MWAVE=16 NWAVE=16 MWARP=16 NWARP=16 VWM=1 VWN=2 SB=0
#conv3x3
INTILE_XSIZE=6 INTILE_YSIZE=6 OUTTILE_XSIZE=4 OUTTILE_YSIZE=4 transLocalSize0=64 transLocalSize1=1 untransLocalSize0=16 untransLocalSize1=2 untransLocalSize2=2
#conv5x5
INTILE_XSIZE=6 INTILE_YSIZE=6 OUTTILE_XSIZE=2 OUTTILE_YSIZE=2 transLocalSize0=64 transLocalSize1=1 untransLocalSize0=16 untransLocalSize1=2 untransLocalSize2=2
#gPool
XYSTRIDE=32 CHANNELSTRIDE=1 BATCHSTRIDE=2
